{
  "event_id": "evt_01HZY8Q9F3K2N7M4P6R8T0V2W4",
  "timestamp": "2026-08-31T14:03:22Z",
  "project": "ai-software-company",
  "task": "validate-organization-repository",
  "agent_id": "release-manager",
  "agent_role": "AI Release Manager",
  "model": "STANDARD_CODING",
  "tool": "github",
  "capability": "github.read",
  "action": "mark_release_ready_for_human_approval",
  "reason": "All Release Gate checks returned PASS with linked evidence.",
  "input_reference": "artifact://release-packages/2026-08-31/summary.md",
  "output_reference": "state://project/APPROVAL",
  "risk_level": 5,
  "previous_state": "STAGING",
  "new_state": "APPROVAL",
  "approval_required": true,
  "approved_by": null,
  "approval_timestamp": null,
  "result": "APPROVAL_REQUIRED",
  "duration": 42.5,
  "estimated_cost": 0.11,
  "error": null
}
